{
  "schema_version": 1,
  "id": "cake-monero-polyseed-zh-hans",
  "display_name": {
    "en": "cake-monero-polyseed-zh-hans",
    "ru": "cake-monero-polyseed-zh-hans"
  },
  "status": "documented",
  "historical": false,
  "evidence_ids": [
    "cake-wallet-language-ui",
    "cake-wallet-monero-service"
  ],
  "verified_on": "2026-09-29",
  "version_interval": {
    "min": "source-9679f91a8c9f63d00500c2b7cc18daf00949bdef",
    "max": "source-9679f91a8c9f63d00500c2b7cc18daf00949bdef"
  },
  "dictionary_ids": [
    "polyseed-zh-hans"
  ],
  "supported_lengths": [
    16
  ],
  "position_rules": [
    "Source-order16-word creation vocabulary; no complete phrase validation."
  ],
  "external_secret": {
    "kind": "optional-passphrase",
    "stored": false,
    "guidance": "Creation encryption only; never interpret this optional setting as a generic restore offset. Tessaveil stores no external secrets."
  },
  "semantic_distinction": "Creation selector for Polyseed16 zh-hans only; optional creation encryption. Restore conditions have separate plain, encrypted and native-offset schemes. Exact dependency byte parity and independent recovery remain unverified.",
  "test_vector_ids": [],
  "no_key_derivation": true,
  "no_complete_phrase_validation": true
}
