{
  "schema_version": 1,
  "id": "cake-electrum-import",
  "display_name": {
    "en": "cake-electrum-import",
    "ru": "cake-electrum-import"
  },
  "status": "blocked",
  "historical": false,
  "evidence_ids": [
    "cake-wallet-electrum-code",
    "cake-wallet-electrum-normalization"
  ],
  "verified_on": "2026-09-29",
  "version_interval": {
    "min": "source-9679f91a8c9f63d00500c2b7cc18daf00949bdef",
    "max": "source-9679f91a8c9f63d00500c2b7cc18daf00949bdef"
  },
  "dictionary_ids": [
    "bip39-en"
  ],
  "supported_lengths": [],
  "position_rules": [
    "Source-order indices; complete phrase checksum/derivation is outside Tessaveil. Prefix100 restoration has no source length constraint; UI and historical length bounds unproven. No selectable arbitrary length invented."
  ],
  "external_secret": {
    "kind": "optional-passphrase",
    "stored": false,
    "guidance": "External recovery secrets are never stored by Tessaveil. Prefix100 restoration has no source length constraint; UI and historical length bounds unproven. No selectable arbitrary length invented."
  },
  "semantic_distinction": "Prefix100 restoration has no source length constraint; UI and historical length bounds unproven. No selectable arbitrary length invented.",
  "test_vector_ids": [],
  "no_key_derivation": true,
  "no_complete_phrase_validation": true
}
