{
  "schema_version": 1,
  "id": "cake-monero-polyseed-plain-ja",
  "display_name": {
    "en": "cake-monero-polyseed-plain-ja",
    "ru": "cake-monero-polyseed-plain-ja"
  },
  "status": "documented",
  "historical": false,
  "evidence_ids": [
    "cake-wallet-language-ui",
    "cake-wallet-polyseed-dispatch"
  ],
  "verified_on": "2026-09-29",
  "version_interval": {
    "min": "source-9679f91a8c9f63d00500c2b7cc18daf00949bdef",
    "max": "source-9679f91a8c9f63d00500c2b7cc18daf00949bdef"
  },
  "dictionary_ids": [
    "polyseed-ja"
  ],
  "supported_lengths": [
    16
  ],
  "position_rules": [
    "Source-order vocabulary per input language; no complete phrase validation."
  ],
  "external_secret": {
    "kind": "none",
    "stored": false,
    "guidance": "Condition: isEncrypted=false; passphrase empty. Input dictionary polyseed-ja,16 words. Direct polyseed.generateKey(POLYSEED_MONERO,32), then restoreWalletFromSpendKeySync; no encryption operation and no seed offset. Source route only; exact native/dependency parity, Unicode normalization and independent wallet recovery unverified. Store required external material only with the original trusted wallet backup; Tessaveil never stores it."
  },
  "semantic_distinction": "Condition: isEncrypted=false; passphrase empty. Input dictionary polyseed-ja,16 words. Direct polyseed.generateKey(POLYSEED_MONERO,32), then restoreWalletFromSpendKeySync; no encryption operation and no seed offset. Source route only; exact native/dependency parity, Unicode normalization and independent wallet recovery unverified.",
  "test_vector_ids": [],
  "no_key_derivation": true,
  "no_complete_phrase_validation": true
}
